{
  "eventType":"purchase-complete",
  "visitorId":"visitor-8f3b1d92",
  "sessionId":"session-c9a12ef4",
  "eventTime":"2026-05-13T18:42:15Z",
  "experimentIds":[
    "ranking-v3",
    "checkout-ui-b"
  ],
  "attributionToken":"AT-93kdls0x82n",
  "productDetails":[
    {
      "product":{
        "name":"projects/demo-project/locations/global/catalogs/default_catalog/branches/0/products/SKU-1001",
        "id":"SKU-1001",
        "type":"PRIMARY",
        "gtin":"00012345600012",
        "categories":[
          "Shoes > Running > Men's Running Shoes"
        ],
        "title":"Nike Air Zoom Pegasus 41",
        "brands":[
          "Nike"
        ],
        "description":"Lightweight men's running shoes with responsive foam cushioning.",
        "languageCode":"en-US",
        "attributes":{
          "style":{
            "text":[
              "running"
            ],
            "numbers":[

            ],
            "searchable":true,
            "indexable":true
          },
          "drop_mm":{
            "text":[

            ],
            "numbers":[
              10
            ],
            "searchable":false,
            "indexable":true
          }
        },
        "tags":[
          "best-seller",
          "summer-2026"
        ],
        "priceInfo":{
          "currencyCode":"USD",
          "price":139.99,
          "originalPrice":159.99,
          "cost":82.5,
          "priceEffectiveTime":"2026-05-01T00:00:00Z",
          "priceExpireTime":"2026-06-01T00:00:00Z",
          "priceRange":{
            "price":139.99,
            "originalPrice":159.99
          }
        },
        "rating":{
          "ratingCount":842,
          "averageRating":4.7,
          "ratingHistogram":[
            12,
            18,
            44,
            173,
            595
          ]
        },
        "availableTime":"2026-04-15T00:00:00Z",
        "availability":"IN_STOCK",
        "availableQuantity":48,
        "fulfillmentInfo":[
          {
            "type":"pickup-in-store",
            "placeIds":[
              "store-001",
              "store-002"
            ]
          },
          {
            "type":"same-day-delivery",
            "placeIds":[
              "warehouse-east"
            ]
          }
        ],
        "uri":"https://store.example.com/products/nike-air-zoom-pegasus-41",
        "images":[
          {
            "uri":"https://cdn.example.com/images/pegasus41-main.jpg",
            "height":1200,
            "width":1200
          },
          {
            "uri":"https://cdn.example.com/images/pegasus41-side.jpg",
            "height":1200,
            "width":1200
          }
        ],
        "audience":{
          "genders":[
            "male"
          ],
          "ageGroups":[
            "adult"
          ]
        },
        "colorInfo":{
          "colorFamilies":[
            "Blue"
          ],
          "colors":[
            "Navy Blue",
            "White"
          ]
        },
        "sizes":[
          "9",
          "10",
          "11"
        ],
        "materials":[
          "Mesh",
          "Rubber"
        ],
        "patterns":[
          "Solid"
        ],
        "conditions":[
          "new"
        ],
        "promotions":[
          {
            "promotionId":"SUMMER_RUN_2026"
          }
        ],
        "publishTime":"2026-04-10T12:00:00Z",
        "retrievableFields":"title,brands,priceInfo,images",
        "variants":[

        ],
        "localInventories":[
          {
            "placeId":"store-001",
            "priceInfo":{
              "currencyCode":"USD",
              "price":139.99
            },
            "attributes":{
              "pickup_time_hours":{
                "text":[

                ],
                "numbers":[
                  2
                ],
                "searchable":false,
                "indexable":false
              }
            },
            "fulfillmentTypes":[
              "pickup-in-store"
            ],
            "availability":"IN_STOCK"
          }
        ],
        "ttl":"2592000s"
      },
      "quantity":1
    }
  ],
  "attributes":{
    "device_type":{
      "text":[
        "mobile"
      ],
      "numbers":[

      ],
      "searchable":true,
      "indexable":true
    },
    "traffic_source":{
      "text":[
        "google_ads"
      ],
      "numbers":[

      ],
      "searchable":false,
      "indexable":true
    }
  },
  "cartId":"cart-9d2e44bc",
  "purchaseTransaction":{
    "id":"txn-20260513-100045",
    "revenue":139.99,
    "taxes":11.2,
    "cost":82.5,
    "currencyCode":"USD"
  },
  "userInfo":{
    "userId":"user-29481",
    "ipAddress":"192.168.10.14",
    "userAgent":"Mozilla/5.0 (iPhone; CPU iPhone OS 18_1 like Mac OS X)",
    "directUserRequest":true
  },
  "uri":"https://store.example.com/checkout/confirmation",
  "referrerUri":"https://store.example.com/cart",
  "pageViewId":"pv-20260513-88af1",
  "entity":"products/SKU-1001",
  "panels":[
    {
      "panelId":"recommended-running-gear",
      "displayName":"Recommended Running Gear",
      "panelPosition":1,
      "productDetails":[
        {
          "product":{
            "id":"SKU-2001",
            "title":"Nike Dri-FIT Running Socks",
            "categories":[
              "Accessories > Socks"
            ],
            "brands":[
              "Nike"
            ],
            "priceInfo":{
              "currencyCode":"USD",
              "price":19.99
            },
            "availability":"IN_STOCK",
            "images":[
              {
                "uri":"https://cdn.example.com/images/socks-main.jpg"
              }
            ]
          },
          "quantity":1
        }
      ]
    }
  ]
}